{
  "schemaVersion": "3.3",
  "title": "Transformasjon",
  "scope": "Sikkerhet av backend.",
  "valuations": [],
  "scenarios": [
    {
      "title": "Ondsinnet bruker ønsker å ta ned løsningen. ",
      "scenario": {
        "ID": "14Kap",
        "description": "Ondsinnet bruer ønsker å ta ned løsningen for å lage kaos hos kartveket.",
        "threatActors": [
          "Organised crime"
        ],
        "vulnerabilities": [
          "User repudiation",
          "Compromised admin user",
          "Escalation of rights",
          "Disclosed secret",
          "Denial of service",
          "Misconfiguration"
        ],
        "risk": {
          "summary": "",
          "probability": 1,
          "consequence": 1000
        },
        "existingActions": "Ddos protection. ",
        "actions": [
          {
            "title": "Innlogging",
            "action": {
              "ID": "w100Q",
              "description": "Innlogging. ",
              "owner": "Kåre",
              "deadline": "2024-06-12",
              "status": "Not started"
            }
          },
          {
            "title": "",
            "action": {
              "ID": "z4B01",
              "description": "Innlogging. ",
              "status": "Not started"
            }
          }
        ],
        "remainingRisk": {
          "summary": "",
          "probability": 0.1,
          "consequence": 1000
        }
      }
    },
    {
      "title": "Tilgang til administratorbruker havner i feil hender.",
      "scenario": {
        "ID": "2dsFd",
        "description": "Tilgang til administratorbruker havner i feil hender og persondata havner på avveie.",
        "threatActors": [
          "Organised crime"
        ],
        "vulnerabilities": [
          "Misconfiguration"
        ],
        "risk": {
          "summary": "",
          "probability": 300,
          "consequence": 1000000000
        },
        "actions": [
          {
            "title": "",
            "action": {
              "ID": "w100Q",
              "description": "Innlogging. ",
              "status": "Not started"
            }
          }
        ],
        "remainingRisk": {
          "summary": "",
          "probability": 0.123,
          "consequence": 198000
        }
      }
    }
  ]
}